{
  "schemaVersion": "1.0.0",
  "applicationId": "creezio.app",
  "sdkVersion": "1.5.0",
  "coreVersion": "0.0.0",
  "policy": {
    "id": "creezio.local-contracts",
    "version": "1.0.0",
    "integrity": "sha256-469b93af15a6dd7066e767f45af8587e613ee2f080d142ed076b00613acb5dfd"
  },
  "compositionIntegrity": "sha256-bc0caa62659b481867b711418d06251115b53646f77527555f4171db399f984a",
  "modules": [
    {
      "moduleId": "creezio.access",
      "origin": "https://github.com/creezio/Creezio-D1R2",
      "version": "0.0.0",
      "source": {
        "kind": "snapshot",
        "revision": "t04-access-models-v1",
        "integrity": "sha256-1199c369429ab962f7603928d3eb2ff38149b9a63f08b155812a54d67660759f"
      },
      "contractIntegrity": "sha256-cc9b9bf2efa3b53d9e20b13f065d982b0731d738ee59a899e93280032333c0d7",
      "runtime": {
        "integrity": "sha256-bbf25d3b0faa8bef371ab5005fb291dc133f11173c1aeedb03221d8faf17b8e2",
        "location": {
          "kind": "local",
          "path": ".creezio/module-artifacts/creezio.access/runtime-bbf25d3b0faa8bef371ab5005fb291dc133f11173c1aeedb03221d8faf17b8e2.tgz"
        }
      },
      "validation": {
        "integrity": "sha256-4d0b5f81632c07d43b55f0a160dbb3f3184ec7a29c1d85dd8d395e0a70713bfa",
        "location": {
          "kind": "local",
          "path": ".creezio/module-artifacts/creezio.access/validation-4d0b5f81632c07d43b55f0a160dbb3f3184ec7a29c1d85dd8d395e0a70713bfa.tgz"
        }
      },
      "dependencies": []
    },
    {
      "moduleId": "example.workspace-witness",
      "origin": "https://github.com/creezio/Creezio-D1R2",
      "version": "1.0.0",
      "source": {
        "kind": "snapshot",
        "revision": "t07-workspace-witness-v1",
        "integrity": "sha256-0000000000000000000000000000000000000000000000000000000000000000"
      },
      "contractIntegrity": "sha256-6e32923c205b87789459100b0922f2cd46cb89296bb9589f633673e5fb0debb3",
      "runtime": {
        "integrity": "sha256-389f78b4603aea02f8c19684c25bd152aea8eadf632b6744b0477769f5efd085",
        "location": {
          "kind": "local",
          "path": ".creezio/module-artifacts/example.workspace-witness/runtime-389f78b4603aea02f8c19684c25bd152aea8eadf632b6744b0477769f5efd085.tgz"
        }
      },
      "validation": {
        "integrity": "sha256-e83f91d349ab71f3f07f7183670e218279a022c5b03d61c22f7b973f8a15c23e",
        "location": {
          "kind": "local",
          "path": ".creezio/module-artifacts/example.workspace-witness/validation-e83f91d349ab71f3f07f7183670e218279a022c5b03d61c22f7b973f8a15c23e.tgz"
        }
      },
      "dependencies": []
    },
    {
      "moduleId": "creezio.conversations",
      "origin": "https://github.com/creezio/Creezio-D1R2",
      "version": "0.0.0",
      "source": {
        "kind": "snapshot",
        "revision": "t14-conversations-v1",
        "integrity": "sha256-fc0483720cafbc7e3d33b23e1ef7fd504a1ea82abb75856c1fee2fcb12d00046"
      },
      "contractIntegrity": "sha256-aab3242cd349c79c77f896fc3eea6cb00a8db807a5a40035ae4871c332c7b57f",
      "runtime": {
        "integrity": "sha256-4074e47b16b4884e67d008aea75130c10b7dd0c73f23b42bce43c4cf9d88cef2",
        "location": {
          "kind": "local",
          "path": ".creezio/module-artifacts/creezio.conversations/runtime-4074e47b16b4884e67d008aea75130c10b7dd0c73f23b42bce43c4cf9d88cef2.tgz"
        }
      },
      "validation": {
        "integrity": "sha256-57e32c35eec574307805428b3f627dbb24638138325545abc82077d8f96ad0aa",
        "location": {
          "kind": "local",
          "path": ".creezio/module-artifacts/creezio.conversations/validation-57e32c35eec574307805428b3f627dbb24638138325545abc82077d8f96ad0aa.tgz"
        }
      },
      "dependencies": [
        {
          "moduleId": "creezio.access",
          "version": "0.0.0"
        }
      ]
    },
    {
      "moduleId": "creezio.openai",
      "origin": "https://github.com/creezio/Creezio-D1R2",
      "version": "0.0.0",
      "source": {
        "kind": "snapshot",
        "revision": "t15-openai-v1",
        "integrity": "sha256-7db2dbed1b2402281b0bf9dbd01bc42376d3d870b10d88cfd488174260cea36e"
      },
      "contractIntegrity": "sha256-757795d2cf79e3a8c3da28e6601a78ee58ea03ca0be73747efdc9b09e27a4249",
      "runtime": {
        "integrity": "sha256-435295eff52b494234a6f2ff1fe3fec24df5aa5fa2a50e4865e5f6ac9b71de11",
        "location": {
          "kind": "local",
          "path": ".creezio/module-artifacts/creezio.openai/runtime-435295eff52b494234a6f2ff1fe3fec24df5aa5fa2a50e4865e5f6ac9b71de11.tgz"
        }
      },
      "validation": {
        "integrity": "sha256-d9db626feb7d091d7410c32a658d2926851e47a949ba1bef14b6d640e9090b10",
        "location": {
          "kind": "local",
          "path": ".creezio/module-artifacts/creezio.openai/validation-d9db626feb7d091d7410c32a658d2926851e47a949ba1bef14b6d640e9090b10.tgz"
        }
      },
      "dependencies": [
        {
          "moduleId": "creezio.conversations",
          "version": "0.0.0"
        }
      ]
    }
  ]
}
