{
  "schemaVersion": "1.0.0",
  "applicationId": "creezio.app",
  "sdkVersion": "1.1.0",
  "coreVersion": "0.0.0",
  "policy": {
    "id": "creezio.local-contracts",
    "version": "1.0.0",
    "integrity": "sha256-469b93af15a6dd7066e767f45af8587e613ee2f080d142ed076b00613acb5dfd"
  },
  "compositionIntegrity": "sha256-e2c08013058ba17c11a09165cc464202e094aa3ed20a6125c5406cff9bf6fd1f",
  "modules": [
    {
      "moduleId": "creezio.access",
      "origin": "https://github.com/creezio/Creezio-D1R2",
      "version": "0.0.0",
      "source": {
        "kind": "snapshot",
        "revision": "t04-access-models-v1",
        "integrity": "sha256-1199c369429ab962f7603928d3eb2ff38149b9a63f08b155812a54d67660759f"
      },
      "contractIntegrity": "sha256-cc9b9bf2efa3b53d9e20b13f065d982b0731d738ee59a899e93280032333c0d7",
      "runtime": {
        "integrity": "sha256-bbf25d3b0faa8bef371ab5005fb291dc133f11173c1aeedb03221d8faf17b8e2",
        "location": {
          "kind": "local",
          "path": ".creezio/module-artifacts/creezio.access/runtime-bbf25d3b0faa8bef371ab5005fb291dc133f11173c1aeedb03221d8faf17b8e2.tgz"
        }
      },
      "validation": {
        "integrity": "sha256-4d0b5f81632c07d43b55f0a160dbb3f3184ec7a29c1d85dd8d395e0a70713bfa",
        "location": {
          "kind": "local",
          "path": ".creezio/module-artifacts/creezio.access/validation-4d0b5f81632c07d43b55f0a160dbb3f3184ec7a29c1d85dd8d395e0a70713bfa.tgz"
        }
      },
      "dependencies": []
    },
    {
      "moduleId": "creezio.modules-settings",
      "origin": "https://github.com/creezio/Creezio-D1R2",
      "version": "0.0.0",
      "source": {
        "kind": "snapshot",
        "revision": "t11-module-models-v1",
        "integrity": "sha256-e3d72387fba5999eb4582bbfe0ba0657fc10285108d312f057587c8fa1c3b57f"
      },
      "contractIntegrity": "sha256-b8f9b50d7444bfacae4391db5204e86cf220f57d8704ddbad805af45c9125b52",
      "runtime": {
        "integrity": "sha256-108fb8029bdbcb749e10279d1f7e7aa350eb2c7e1e2169e0db3e3e07bf5ba85d",
        "location": {
          "kind": "local",
          "path": ".creezio/module-artifacts/creezio.modules-settings/runtime-108fb8029bdbcb749e10279d1f7e7aa350eb2c7e1e2169e0db3e3e07bf5ba85d.tgz"
        }
      },
      "validation": {
        "integrity": "sha256-51c8640a4179c35934cd61610d2b1f2c33909edb32562a20edbc134e88cd291f",
        "location": {
          "kind": "local",
          "path": ".creezio/module-artifacts/creezio.modules-settings/validation-51c8640a4179c35934cd61610d2b1f2c33909edb32562a20edbc134e88cd291f.tgz"
        }
      },
      "dependencies": [
        {
          "moduleId": "creezio.access",
          "version": "0.0.0"
        }
      ]
    },
    {
      "moduleId": "creezio.conversations",
      "origin": "https://github.com/creezio/Creezio-D1R2",
      "version": "0.0.0",
      "source": {
        "kind": "snapshot",
        "revision": "t14-conversations-v1",
        "integrity": "sha256-fc0483720cafbc7e3d33b23e1ef7fd504a1ea82abb75856c1fee2fcb12d00046"
      },
      "contractIntegrity": "sha256-8458bbab7abb2fd67ea3527f74a15e8bb591b75b1d1d33756ce9e45439941b02",
      "runtime": {
        "integrity": "sha256-eeb2da0c8a9abfbcb9c0e502747f62c8aab5d23a173cef90205ecbcd9e6080da",
        "location": {
          "kind": "local",
          "path": ".creezio/module-artifacts/creezio.conversations/runtime-eeb2da0c8a9abfbcb9c0e502747f62c8aab5d23a173cef90205ecbcd9e6080da.tgz"
        }
      },
      "validation": {
        "integrity": "sha256-f4ad074a9e08570f0f03f0a22a83b22846d1c5dd60f0293f66ed6777ee528fea",
        "location": {
          "kind": "local",
          "path": ".creezio/module-artifacts/creezio.conversations/validation-f4ad074a9e08570f0f03f0a22a83b22846d1c5dd60f0293f66ed6777ee528fea.tgz"
        }
      },
      "dependencies": [
        {
          "moduleId": "creezio.access",
          "version": "0.0.0"
        }
      ]
    },
    {
      "moduleId": "creezio.openai",
      "origin": "https://github.com/creezio/Creezio-D1R2",
      "version": "0.0.0",
      "source": {
        "kind": "snapshot",
        "revision": "t15-openai-v1",
        "integrity": "sha256-7db2dbed1b2402281b0bf9dbd01bc42376d3d870b10d88cfd488174260cea36e"
      },
      "contractIntegrity": "sha256-757795d2cf79e3a8c3da28e6601a78ee58ea03ca0be73747efdc9b09e27a4249",
      "runtime": {
        "integrity": "sha256-435295eff52b494234a6f2ff1fe3fec24df5aa5fa2a50e4865e5f6ac9b71de11",
        "location": {
          "kind": "local",
          "path": ".creezio/module-artifacts/creezio.openai/runtime-435295eff52b494234a6f2ff1fe3fec24df5aa5fa2a50e4865e5f6ac9b71de11.tgz"
        }
      },
      "validation": {
        "integrity": "sha256-d9db626feb7d091d7410c32a658d2926851e47a949ba1bef14b6d640e9090b10",
        "location": {
          "kind": "local",
          "path": ".creezio/module-artifacts/creezio.openai/validation-d9db626feb7d091d7410c32a658d2926851e47a949ba1bef14b6d640e9090b10.tgz"
        }
      },
      "dependencies": [
        {
          "moduleId": "creezio.conversations",
          "version": "0.0.0"
        }
      ]
    },
    {
      "moduleId": "creezio.delivery",
      "origin": "https://github.com/creezio/Creezio-D1R2",
      "version": "0.0.0",
      "source": {
        "kind": "snapshot",
        "revision": "t32-local-delivery-v1",
        "integrity": "sha256-b0aa38d3948972d4978593cf9c40fc8ce2dafc42b597f2cedcd4b08d128853e8"
      },
      "contractIntegrity": "sha256-3e411f0c68d9a491f7cb72a35de54c83768c15139d5752b72820c859b0127d4c",
      "runtime": {
        "integrity": "sha256-f01242631e6fb6fb37dac9b2218156b0d452353b58372e0ecda660e9f5d8fd8c",
        "location": {
          "kind": "local",
          "path": ".creezio/module-artifacts/creezio.delivery/runtime-f01242631e6fb6fb37dac9b2218156b0d452353b58372e0ecda660e9f5d8fd8c.tgz"
        }
      },
      "validation": {
        "integrity": "sha256-903e4f752f36f1df099e6ef6cc330d7cee66a8c40b29ea78dae2e3eedefc753f",
        "location": {
          "kind": "local",
          "path": ".creezio/module-artifacts/creezio.delivery/validation-903e4f752f36f1df099e6ef6cc330d7cee66a8c40b29ea78dae2e3eedefc753f.tgz"
        }
      },
      "dependencies": []
    }
  ]
}
