{
  "schemaVersion": "1.0.0",
  "applicationId": "creezio.app",
  "sdkVersion": "1.9.0",
  "coreVersion": "0.0.0",
  "policy": {
    "id": "creezio.local-contracts",
    "version": "1.0.0",
    "integrity": "sha256-469b93af15a6dd7066e767f45af8587e613ee2f080d142ed076b00613acb5dfd"
  },
  "compositionIntegrity": "sha256-37693de7fac3dd99716ba484fdc05236f1a9b581fa78aabadb8a14f378ef8bc6",
  "modules": [
    {
      "moduleId": "creezio.access",
      "origin": "https://github.com/creezio/Creezio-D1R2",
      "version": "0.0.0",
      "source": {
        "kind": "snapshot",
        "revision": "t04-access-models-v1",
        "integrity": "sha256-d4f4508231a8db2e7fc9d399786754bb7c1eba25dcc89632405a7f0f1966151d"
      },
      "contractIntegrity": "sha256-7a8aa454d0d9dd55e2d95add53ccb6fc30c486658d39e7025992a35f51c1e166",
      "runtime": {
        "integrity": "sha256-88526a2ee7dbd19de93bbbc801a9b5471cad741bf71858d78ce0bcd1c98a7523",
        "location": {
          "kind": "local",
          "path": ".creezio/module-artifacts/creezio.access/runtime-88526a2ee7dbd19de93bbbc801a9b5471cad741bf71858d78ce0bcd1c98a7523.tgz"
        }
      },
      "validation": {
        "integrity": "sha256-a94ddf06f88d65952d3c1931f9deac09752d22e4944d9467c8c142941cec1ed0",
        "location": {
          "kind": "local",
          "path": ".creezio/module-artifacts/creezio.access/validation-a94ddf06f88d65952d3c1931f9deac09752d22e4944d9467c8c142941cec1ed0.tgz"
        }
      },
      "dependencies": []
    },
    {
      "moduleId": "creezio.modules-settings",
      "origin": "https://github.com/creezio/Creezio-D1R2",
      "version": "0.0.0",
      "source": {
        "kind": "snapshot",
        "revision": "t11-module-models-v1",
        "integrity": "sha256-e3d72387fba5999eb4582bbfe0ba0657fc10285108d312f057587c8fa1c3b57f"
      },
      "contractIntegrity": "sha256-404864e15ee92306de30cac74af2c99803c687a449875798a503c8c6a3d44949",
      "runtime": {
        "integrity": "sha256-f98b4bfd378e9c08921b42b0587139a5523654f9fd3e94d632cd2ad3ccc5582d",
        "location": {
          "kind": "local",
          "path": ".creezio/module-artifacts/creezio.modules-settings/runtime-f98b4bfd378e9c08921b42b0587139a5523654f9fd3e94d632cd2ad3ccc5582d.tgz"
        }
      },
      "validation": {
        "integrity": "sha256-050b4a506cf5f1a75452f5d359fe330966f211ab1093c90f7c2dbdb0eb007b40",
        "location": {
          "kind": "local",
          "path": ".creezio/module-artifacts/creezio.modules-settings/validation-050b4a506cf5f1a75452f5d359fe330966f211ab1093c90f7c2dbdb0eb007b40.tgz"
        }
      },
      "dependencies": [
        {
          "moduleId": "creezio.access",
          "version": "0.0.0"
        }
      ]
    },
    {
      "moduleId": "creezio.conversations",
      "origin": "https://github.com/creezio/Creezio-D1R2",
      "version": "0.0.0",
      "source": {
        "kind": "snapshot",
        "revision": "t14-conversations-v1",
        "integrity": "sha256-fc0483720cafbc7e3d33b23e1ef7fd504a1ea82abb75856c1fee2fcb12d00046"
      },
      "contractIntegrity": "sha256-aab3242cd349c79c77f896fc3eea6cb00a8db807a5a40035ae4871c332c7b57f",
      "runtime": {
        "integrity": "sha256-16ecbc9088bfa70a019a43451319facef030e15ef5a169131e94c21794429f65",
        "location": {
          "kind": "local",
          "path": ".creezio/module-artifacts/creezio.conversations/runtime-16ecbc9088bfa70a019a43451319facef030e15ef5a169131e94c21794429f65.tgz"
        }
      },
      "validation": {
        "integrity": "sha256-568bdc37d8c33cc287977518cc9689bd7791251999398b00759a835ba1f2b736",
        "location": {
          "kind": "local",
          "path": ".creezio/module-artifacts/creezio.conversations/validation-568bdc37d8c33cc287977518cc9689bd7791251999398b00759a835ba1f2b736.tgz"
        }
      },
      "dependencies": [
        {
          "moduleId": "creezio.access",
          "version": "0.0.0"
        }
      ]
    },
    {
      "moduleId": "creezio.openai",
      "origin": "https://github.com/creezio/Creezio-D1R2",
      "version": "0.0.0",
      "source": {
        "kind": "snapshot",
        "revision": "t15-openai-v1",
        "integrity": "sha256-7db2dbed1b2402281b0bf9dbd01bc42376d3d870b10d88cfd488174260cea36e"
      },
      "contractIntegrity": "sha256-757795d2cf79e3a8c3da28e6601a78ee58ea03ca0be73747efdc9b09e27a4249",
      "runtime": {
        "integrity": "sha256-435295eff52b494234a6f2ff1fe3fec24df5aa5fa2a50e4865e5f6ac9b71de11",
        "location": {
          "kind": "local",
          "path": ".creezio/module-artifacts/creezio.openai/runtime-435295eff52b494234a6f2ff1fe3fec24df5aa5fa2a50e4865e5f6ac9b71de11.tgz"
        }
      },
      "validation": {
        "integrity": "sha256-d9db626feb7d091d7410c32a658d2926851e47a949ba1bef14b6d640e9090b10",
        "location": {
          "kind": "local",
          "path": ".creezio/module-artifacts/creezio.openai/validation-d9db626feb7d091d7410c32a658d2926851e47a949ba1bef14b6d640e9090b10.tgz"
        }
      },
      "dependencies": [
        {
          "moduleId": "creezio.conversations",
          "version": "0.0.0"
        }
      ]
    },
    {
      "moduleId": "creezio.theme-chatgpt",
      "origin": "https://github.com/creezio/Creezio-D1R2",
      "version": "0.0.0",
      "source": {
        "kind": "snapshot",
        "revision": "t13-chatgpt-theme-v1",
        "integrity": "sha256-0000000000000000000000000000000000000000000000000000000000000000"
      },
      "contractIntegrity": "sha256-9d71ef99ea8e9379b859eefd56a4b6c71f427a4ee07aa35eb90063a05a370d94",
      "runtime": {
        "integrity": "sha256-4ae187134d8cadac42fdf0d5865a0edf26469f0a473ac6a7fa8ba7b6ee58ca71",
        "location": {
          "kind": "local",
          "path": ".creezio/module-artifacts/creezio.theme-chatgpt/runtime-4ae187134d8cadac42fdf0d5865a0edf26469f0a473ac6a7fa8ba7b6ee58ca71.tgz"
        }
      },
      "validation": {
        "integrity": "sha256-cf9a91437630778ce21d286e1b66388520c872de304e288b04f4fc0e4ca035e0",
        "location": {
          "kind": "local",
          "path": ".creezio/module-artifacts/creezio.theme-chatgpt/validation-cf9a91437630778ce21d286e1b66388520c872de304e288b04f4fc0e4ca035e0.tgz"
        }
      },
      "dependencies": []
    },
    {
      "moduleId": "example.widgets-witness",
      "origin": "https://github.com/creezio/Creezio-D1R2",
      "version": "1.0.0",
      "source": {
        "kind": "snapshot",
        "revision": "t16-widgets-witness-v1",
        "integrity": "sha256-0000000000000000000000000000000000000000000000000000000000000000"
      },
      "contractIntegrity": "sha256-62ddec5a8fed7a38fa893c1ea1b43c7da4b4261916cec10a0dbcc68b371fa6c2",
      "runtime": {
        "integrity": "sha256-3ad7869e727a096e1dc29b33d9b020a80441ba474328f70d1cfdd64ecdb336b9",
        "location": {
          "kind": "local",
          "path": ".creezio/module-artifacts/example.widgets-witness/runtime-3ad7869e727a096e1dc29b33d9b020a80441ba474328f70d1cfdd64ecdb336b9.tgz"
        }
      },
      "validation": {
        "integrity": "sha256-80be04e676c0a6997198427ae970c4eef066b51428acb61f27f88cc53f3b50cb",
        "location": {
          "kind": "local",
          "path": ".creezio/module-artifacts/example.widgets-witness/validation-80be04e676c0a6997198427ae970c4eef066b51428acb61f27f88cc53f3b50cb.tgz"
        }
      },
      "dependencies": []
    },
    {
      "moduleId": "creezio.delivery",
      "origin": "https://github.com/creezio/Creezio-D1R2",
      "version": "0.0.0",
      "source": {
        "kind": "snapshot",
        "revision": "t32-local-delivery-v1",
        "integrity": "sha256-b0aa38d3948972d4978593cf9c40fc8ce2dafc42b597f2cedcd4b08d128853e8"
      },
      "contractIntegrity": "sha256-fe60ddd08a8c76ad84f86abbd6ef74b32c7be059cf9a3ff789bd300f32899fe7",
      "runtime": {
        "integrity": "sha256-41d7e6c9d9a28b9bf20e60c7e855746d769774754cc158a24efebe0e556a258e",
        "location": {
          "kind": "local",
          "path": ".creezio/module-artifacts/creezio.delivery/runtime-41d7e6c9d9a28b9bf20e60c7e855746d769774754cc158a24efebe0e556a258e.tgz"
        }
      },
      "validation": {
        "integrity": "sha256-9989d79e6d6fdf4516643672b2f891b7dddc9ac3c46bacedadf6d7020610de9e",
        "location": {
          "kind": "local",
          "path": ".creezio/module-artifacts/creezio.delivery/validation-9989d79e6d6fdf4516643672b2f891b7dddc9ac3c46bacedadf6d7020610de9e.tgz"
        }
      },
      "dependencies": []
    }
  ]
}
