{
  "schemaVersion": "1.0.0",
  "applicationId": "creezio.app",
  "sdkVersion": "1.7.0",
  "coreVersion": "0.0.0",
  "policy": {
    "id": "creezio.local-contracts",
    "version": "1.0.0",
    "integrity": "sha256-469b93af15a6dd7066e767f45af8587e613ee2f080d142ed076b00613acb5dfd"
  },
  "compositionIntegrity": "sha256-86ffe3ea6aac1cb8ed561d6b65b00e9d1db15009111898e6c045fc3a0431feaf",
  "modules": [
    {
      "moduleId": "creezio.access",
      "origin": "https://github.com/creezio/Creezio-D1R2",
      "version": "0.0.0",
      "source": {
        "kind": "snapshot",
        "revision": "t04-access-models-v1",
        "integrity": "sha256-1199c369429ab962f7603928d3eb2ff38149b9a63f08b155812a54d67660759f"
      },
      "contractIntegrity": "sha256-a8e3e4150a861d3869f92f66f4dbec6e302dbe188b4fbd9888d91ce673b932ce",
      "runtime": {
        "integrity": "sha256-3b2511335e9e88c0250da3cb03edf0322de0fc6e2c8832b59c9c1cad97460cf9",
        "location": {
          "kind": "local",
          "path": ".creezio/module-artifacts/creezio.access/runtime-3b2511335e9e88c0250da3cb03edf0322de0fc6e2c8832b59c9c1cad97460cf9.tgz"
        }
      },
      "validation": {
        "integrity": "sha256-4d0b5f81632c07d43b55f0a160dbb3f3184ec7a29c1d85dd8d395e0a70713bfa",
        "location": {
          "kind": "local",
          "path": ".creezio/module-artifacts/creezio.access/validation-4d0b5f81632c07d43b55f0a160dbb3f3184ec7a29c1d85dd8d395e0a70713bfa.tgz"
        }
      },
      "dependencies": []
    },
    {
      "moduleId": "creezio.modules-settings",
      "origin": "https://github.com/creezio/Creezio-D1R2",
      "version": "0.0.0",
      "source": {
        "kind": "snapshot",
        "revision": "t11-module-models-v1",
        "integrity": "sha256-e3d72387fba5999eb4582bbfe0ba0657fc10285108d312f057587c8fa1c3b57f"
      },
      "contractIntegrity": "sha256-404864e15ee92306de30cac74af2c99803c687a449875798a503c8c6a3d44949",
      "runtime": {
        "integrity": "sha256-f98b4bfd378e9c08921b42b0587139a5523654f9fd3e94d632cd2ad3ccc5582d",
        "location": {
          "kind": "local",
          "path": ".creezio/module-artifacts/creezio.modules-settings/runtime-f98b4bfd378e9c08921b42b0587139a5523654f9fd3e94d632cd2ad3ccc5582d.tgz"
        }
      },
      "validation": {
        "integrity": "sha256-050b4a506cf5f1a75452f5d359fe330966f211ab1093c90f7c2dbdb0eb007b40",
        "location": {
          "kind": "local",
          "path": ".creezio/module-artifacts/creezio.modules-settings/validation-050b4a506cf5f1a75452f5d359fe330966f211ab1093c90f7c2dbdb0eb007b40.tgz"
        }
      },
      "dependencies": [
        {
          "moduleId": "creezio.access",
          "version": "0.0.0"
        }
      ]
    },
    {
      "moduleId": "creezio.conversations",
      "origin": "https://github.com/creezio/Creezio-D1R2",
      "version": "0.0.0",
      "source": {
        "kind": "snapshot",
        "revision": "t14-conversations-v1",
        "integrity": "sha256-fc0483720cafbc7e3d33b23e1ef7fd504a1ea82abb75856c1fee2fcb12d00046"
      },
      "contractIntegrity": "sha256-aab3242cd349c79c77f896fc3eea6cb00a8db807a5a40035ae4871c332c7b57f",
      "runtime": {
        "integrity": "sha256-a1f088e0089795de59bc4bb993a59e94963dc2072de046dc25f1532818b7f127",
        "location": {
          "kind": "local",
          "path": ".creezio/module-artifacts/creezio.conversations/runtime-a1f088e0089795de59bc4bb993a59e94963dc2072de046dc25f1532818b7f127.tgz"
        }
      },
      "validation": {
        "integrity": "sha256-3abd925baefbab17c9f33826c1e8b96491a3a30f6f5a10529ee7b226c88f2334",
        "location": {
          "kind": "local",
          "path": ".creezio/module-artifacts/creezio.conversations/validation-3abd925baefbab17c9f33826c1e8b96491a3a30f6f5a10529ee7b226c88f2334.tgz"
        }
      },
      "dependencies": [
        {
          "moduleId": "creezio.access",
          "version": "0.0.0"
        }
      ]
    },
    {
      "moduleId": "creezio.openai",
      "origin": "https://github.com/creezio/Creezio-D1R2",
      "version": "0.0.0",
      "source": {
        "kind": "snapshot",
        "revision": "t15-openai-v1",
        "integrity": "sha256-7db2dbed1b2402281b0bf9dbd01bc42376d3d870b10d88cfd488174260cea36e"
      },
      "contractIntegrity": "sha256-757795d2cf79e3a8c3da28e6601a78ee58ea03ca0be73747efdc9b09e27a4249",
      "runtime": {
        "integrity": "sha256-435295eff52b494234a6f2ff1fe3fec24df5aa5fa2a50e4865e5f6ac9b71de11",
        "location": {
          "kind": "local",
          "path": ".creezio/module-artifacts/creezio.openai/runtime-435295eff52b494234a6f2ff1fe3fec24df5aa5fa2a50e4865e5f6ac9b71de11.tgz"
        }
      },
      "validation": {
        "integrity": "sha256-d9db626feb7d091d7410c32a658d2926851e47a949ba1bef14b6d640e9090b10",
        "location": {
          "kind": "local",
          "path": ".creezio/module-artifacts/creezio.openai/validation-d9db626feb7d091d7410c32a658d2926851e47a949ba1bef14b6d640e9090b10.tgz"
        }
      },
      "dependencies": [
        {
          "moduleId": "creezio.conversations",
          "version": "0.0.0"
        }
      ]
    },
    {
      "moduleId": "creezio.theme-chatgpt",
      "origin": "https://github.com/creezio/Creezio-D1R2",
      "version": "0.0.0",
      "source": {
        "kind": "snapshot",
        "revision": "t13-chatgpt-theme-v1",
        "integrity": "sha256-0000000000000000000000000000000000000000000000000000000000000000"
      },
      "contractIntegrity": "sha256-9d71ef99ea8e9379b859eefd56a4b6c71f427a4ee07aa35eb90063a05a370d94",
      "runtime": {
        "integrity": "sha256-4ae187134d8cadac42fdf0d5865a0edf26469f0a473ac6a7fa8ba7b6ee58ca71",
        "location": {
          "kind": "local",
          "path": ".creezio/module-artifacts/creezio.theme-chatgpt/runtime-4ae187134d8cadac42fdf0d5865a0edf26469f0a473ac6a7fa8ba7b6ee58ca71.tgz"
        }
      },
      "validation": {
        "integrity": "sha256-cf9a91437630778ce21d286e1b66388520c872de304e288b04f4fc0e4ca035e0",
        "location": {
          "kind": "local",
          "path": ".creezio/module-artifacts/creezio.theme-chatgpt/validation-cf9a91437630778ce21d286e1b66388520c872de304e288b04f4fc0e4ca035e0.tgz"
        }
      },
      "dependencies": []
    },
    {
      "moduleId": "example.widgets-witness",
      "origin": "https://github.com/creezio/Creezio-D1R2",
      "version": "1.0.0",
      "source": {
        "kind": "snapshot",
        "revision": "t16-widgets-witness-v1",
        "integrity": "sha256-0000000000000000000000000000000000000000000000000000000000000000"
      },
      "contractIntegrity": "sha256-62ddec5a8fed7a38fa893c1ea1b43c7da4b4261916cec10a0dbcc68b371fa6c2",
      "runtime": {
        "integrity": "sha256-3ad7869e727a096e1dc29b33d9b020a80441ba474328f70d1cfdd64ecdb336b9",
        "location": {
          "kind": "local",
          "path": ".creezio/module-artifacts/example.widgets-witness/runtime-3ad7869e727a096e1dc29b33d9b020a80441ba474328f70d1cfdd64ecdb336b9.tgz"
        }
      },
      "validation": {
        "integrity": "sha256-80be04e676c0a6997198427ae970c4eef066b51428acb61f27f88cc53f3b50cb",
        "location": {
          "kind": "local",
          "path": ".creezio/module-artifacts/example.widgets-witness/validation-80be04e676c0a6997198427ae970c4eef066b51428acb61f27f88cc53f3b50cb.tgz"
        }
      },
      "dependencies": []
    },
    {
      "moduleId": "creezio.delivery",
      "origin": "https://github.com/creezio/Creezio-D1R2",
      "version": "0.0.0",
      "source": {
        "kind": "snapshot",
        "revision": "t32-local-delivery-v1",
        "integrity": "sha256-b0aa38d3948972d4978593cf9c40fc8ce2dafc42b597f2cedcd4b08d128853e8"
      },
      "contractIntegrity": "sha256-0122ad8ebb0c80242c86522346e249d663e49c78f80afd09a1cd76a7eda80fa1",
      "runtime": {
        "integrity": "sha256-e5435c567857594af608bc9655404df56ef4defd5ff1b2e5db2befecaedf6800",
        "location": {
          "kind": "local",
          "path": ".creezio/module-artifacts/creezio.delivery/runtime-e5435c567857594af608bc9655404df56ef4defd5ff1b2e5db2befecaedf6800.tgz"
        }
      },
      "validation": {
        "integrity": "sha256-329fb0e45f89327afb8c13dde9b09fcf7c938174a971d1230c99ce45d880b16d",
        "location": {
          "kind": "local",
          "path": ".creezio/module-artifacts/creezio.delivery/validation-329fb0e45f89327afb8c13dde9b09fcf7c938174a971d1230c99ce45d880b16d.tgz"
        }
      },
      "dependencies": []
    }
  ]
}
