{
  "schemaVersion": "1.0.0",
  "applicationId": "creezio.app",
  "sdkVersion": "1.8.0",
  "coreVersion": "0.0.0",
  "policy": {
    "id": "creezio.local-contracts",
    "version": "1.0.0",
    "integrity": "sha256-469b93af15a6dd7066e767f45af8587e613ee2f080d142ed076b00613acb5dfd"
  },
  "compositionIntegrity": "sha256-375e9ff3cd4b1c0407c9c60d9b4bfa5264871fb720adde0716bc65d149eb2a95",
  "modules": [
    {
      "moduleId": "example.witness",
      "origin": "https://github.com/creezio/Creezio-D1R2",
      "version": "1.0.0",
      "source": {
        "kind": "snapshot",
        "revision": "t03-witness-v1",
        "integrity": "sha256-0619df714913a3ba1d18df4d7cc534bf1b2e094aad01c3f8470c0f0fa885ff0b"
      },
      "contractIntegrity": "sha256-3da074a6d2305bce5d5065c2dead5306210a2bfe36b3d486426f9f8f92b7d609",
      "runtime": {
        "integrity": "sha256-198ed73c2dd2ff4c6f4f905bf23ad96222ba7f00af773f947b622f73587ea41c",
        "location": {
          "kind": "local",
          "path": ".creezio/module-artifacts/example.witness/runtime-198ed73c2dd2ff4c6f4f905bf23ad96222ba7f00af773f947b622f73587ea41c.tgz"
        }
      },
      "validation": {
        "integrity": "sha256-46b64a493744c1dde778569af68df5500ccd9ba47f13a0c8259d94216c851254",
        "location": {
          "kind": "local",
          "path": ".creezio/module-artifacts/example.witness/validation-46b64a493744c1dde778569af68df5500ccd9ba47f13a0c8259d94216c851254.tgz"
        }
      },
      "dependencies": []
    }
  ]
}
